{
  "specification_id": "TNM-DEMO",
  "version": "2024",
  "title": "Synthetic National Topographic Map Demonstration Specification",
  "status": "synthetic-public-fixture",
  "license": "CC0-1.0",
  "notice": "This is a synthetic benchmark fixture. It is not an official Taiwan specification.",
  "layer": {"id": "J01_RIVERL", "label": "River centreline", "geometry_type": "LineString", "crs": "OGC:CRS84"},
  "rules": [
    {"rule_id": "NMA-CRS-001", "rule_type": "dataset_crs", "target": "J01_RIVERL", "severity": "error", "constraint": {"equals": "OGC:CRS84"}, "message": "The public GeoJSON exchange fixture must declare OGC:CRS84.", "repair": {"mode": "proposal", "operation": "transform_crs"}, "evidence": {"document": "TNM Demo Specification", "version": "2024", "section": "2.1", "uri": "spec://TNM-DEMO/2024/2.1", "excerpt": "The public GeoJSON exchange profile uses OGC:CRS84."}},
    {"rule_id": "NMA-GEOM-001", "rule_type": "geometry_type", "target": "J01_RIVERL", "severity": "error", "constraint": {"equals": "LineString"}, "message": "River centreline features must use LineString geometry.", "repair": {"mode": "none"}, "evidence": {"document": "TNM Demo Specification", "version": "2024", "section": "3.1", "uri": "spec://TNM-DEMO/2024/3.1", "excerpt": "The geometry class of J01_RIVERL is LineString."}},
    {"rule_id": "NMA-SCHEMA-001", "rule_type": "required_field", "target": "J01_RIVERL.feature_id", "severity": "error", "constraint": {"field": "feature_id", "type": "string"}, "message": "Every feature must have a non-empty authoritative feature identifier.", "repair": {"mode": "none"}, "evidence": {"document": "TNM Demo Specification", "version": "2024", "section": "4.2.1", "uri": "spec://TNM-DEMO/2024/4.2.1", "excerpt": "feature_id is mandatory and shall not be synthesized during validation."}},
    {"rule_id": "NMA-SCHEMA-002", "rule_type": "required_field", "target": "J01_RIVERL.name", "severity": "error", "constraint": {"field": "name", "type": "string"}, "message": "Every demonstration river feature must have a non-empty name.", "repair": {"mode": "none"}, "evidence": {"document": "TNM Demo Specification", "version": "2024", "section": "4.2.2", "uri": "spec://TNM-DEMO/2024/4.2.2", "excerpt": "name is mandatory for the public demonstration layer."}},
    {"rule_id": "NMA-SCHEMA-003", "rule_type": "required_field", "target": "J01_RIVERL.source_date", "severity": "error", "constraint": {"field": "source_date", "type": "string"}, "message": "Version 2024 requires the source observation date.", "repair": {"mode": "none"}, "evidence": {"document": "TNM Demo Specification", "version": "2024", "section": "4.2.4", "uri": "spec://TNM-DEMO/2024/4.2.4", "excerpt": "source_date became mandatory in version 2024."}},
    {"rule_id": "NMA-DOMAIN-001", "rule_type": "domain", "target": "J01_RIVERL.river_class", "severity": "error", "constraint": {"field": "river_class", "allowed": ["primary", "secondary", "drainage", "tidal"]}, "message": "river_class must use a value from the specification code list.", "repair": {"mode": "proposal", "operation": "map_code"}, "evidence": {"document": "TNM Demo Specification", "version": "2024", "section": "4.3", "uri": "spec://TNM-DEMO/2024/4.3", "excerpt": "The 2024 code list adds tidal to primary, secondary, and drainage."}},
    {"rule_id": "NMA-UNIQUE-001", "rule_type": "unique_field", "target": "J01_RIVERL.feature_id", "severity": "error", "constraint": {"field": "feature_id"}, "message": "feature_id values must be unique within the layer.", "repair": {"mode": "none"}, "evidence": {"document": "TNM Demo Specification", "version": "2024", "section": "4.2.3", "uri": "spec://TNM-DEMO/2024/4.2.3", "excerpt": "feature_id is the layer-wide unique identifier."}},
    {"rule_id": "NMA-TOPO-001", "rule_type": "line_no_self_intersection", "target": "J01_RIVERL.geometry", "severity": "error", "constraint": {}, "message": "A river centreline must not self-intersect.", "repair": {"mode": "proposal", "operation": "review_geometry"}, "evidence": {"document": "TNM Demo Specification", "version": "2024", "section": "5.1", "uri": "spec://TNM-DEMO/2024/5.1", "excerpt": "J01_RIVERL geometry shall be simple and free from self-intersections."}},
    {"rule_id": "NMA-FORMAT-001", "rule_type": "trimmed_string", "target": "J01_RIVERL.name", "severity": "warning", "constraint": {"field": "name"}, "message": "Names should not contain leading or trailing whitespace.", "repair": {"mode": "safe", "operation": "trim"}, "evidence": {"document": "TNM Demo Specification", "version": "2024", "section": "4.4", "uri": "spec://TNM-DEMO/2024/4.4", "excerpt": "String values are stored without leading or trailing whitespace."}}
  ]
}
